{
    "$schema": "http://json-schema.org/draft-07/schema#",
    "type": "object",
    "required": ["threadTitle", "id", "priority", "posts"],
    "properties": {
        "id": {
            "type": "string"
        },
        "conditions":{
            "type": "array",
            "items":{
                "$ref": "../requiremntsSchema.json"
            }
        },
        "priority": {
            "type": "integer"
        },
        "threadTitle":{
            "type": "string"
        },
        "createdBy":{
            "type": "string",
            "$ref": "./usernameSchema.json"
        },
        "posts":{
            "type":"array",
            "items": {
                "$ref": "./postSchema.json"
            }
        }
    }
}
